{
  "source": "오산시 홈페이지 직원 업무 목록(성명 가림) + 오산시 행정기구 및 정원 조례 시행규칙 별표 분장사무, pingpong_zero 정리본",
  "source_url": "https://www.osan.go.kr/portal/staff/list.do",
  "law_url": "https://www.law.go.kr/자치법규/오산시행정기구및정원조례시행규칙",
  "fetched_at": "2026-10-30",
  "seats": [
    {
      "seat_id": "S-CIVIL-01",
      "dept_id": "D-CIVIL",
      "team": null,
      "role": "과장",
      "label": "과장",
      "tasks": [
        {
          "task_id": "T00815",
          "title": "민원여권과 업무총괄",
          "kind": "총괄",
          "label": "해당없음",
          "basis": null,
          "other_dept": null
        }
      ]
    },
    {
      "seat_id": "S-CIVIL-02",
      "dept_id": "D-CIVIL",
      "team": "민원행정팀",
      "role": "팀장",
      "label": "민원행정팀 팀장",
      "tasks": [
        {
          "task_id": "T00816",
          "title": "민원행정팀 업무 총괄",
          "kind": "총괄",
          "label": "해당없음",
          "basis": null,
          "other_dept": null
        },
        {
          "task_id": "T00817",
          "title": "민원실 환경개선 및 국민행복민원실 관련",
          "kind": "고유업무",
          "label": "후보",
          "basis": {
            "law": "오산시 행정기구 및 정원 조례 시행규칙",
            "article": "별표 1(제3조 관련)",
            "item_no": 4,
            "item": "민원행정 및 제도개선",
            "score": 0.1632
          },
          "other_dept": null
        },
        {
          "task_id": "T00818",
          "title": "민원조정 및 상담(국민신문고 등)",
          "kind": "고유업무",
          "label": "후보",
          "basis": {
            "law": "오산시 행정기구 및 정원 조례 시행규칙",
            "article": "별표 1(제3조 관련)",
            "item_no": 12,
            "item": "국민신문고 운영",
            "score": 0.5471
          },
          "other_dept": null
        },
        {
          "task_id": "T00819",
          "title": "민원조정위원회 운영",
          "kind": "고유업무",
          "label": "직접근거",
          "basis": {
            "law": "오산시 행정기구 및 정원 조례 시행규칙",
            "article": "별표 1(제3조 관련)",
            "item_no": 15,
            "item": "민원조정위원회 운영",
            "score": 1.05
          },
          "other_dept": null
        }
      ]
    },
    {
      "seat_id": "S-CIVIL-03",
      "dept_id": "D-CIVIL",
      "team": "민원행정팀",
      "role": "주무관",
      "label": "민원행정팀 주무관 1",
      "tasks": [
        {
          "task_id": "T00820",
          "title": "국민신문고 민원접수·배부 및 관리 (민원서비스 종합평가 분야 포함)",
          "kind": "고유업무",
          "label": "직접근거",
          "basis": {
            "law": "오산시 행정기구 및 정원 조례 시행규칙",
            "article": "별표 1(제3조 관련)",
            "item_no": 2,
            "item": "국민신문고 민원접수 처리",
            "score": 0.6277
          },
          "other_dept": null
        },
        {
          "task_id": "T00821",
          "title": "시스템 사용자 권한관리 및 현행화 (행정정보공동이용, 국민신문고, 공공서비스 통합관리,외국인정보공동이용, 민원처리운영창구)",
          "kind": "고유업무",
          "label": "직접근거",
          "basis": {
            "law": "오산시 행정기구 및 정원 조례 시행규칙",
            "article": "별표 1(제3조 관련)",
            "item_no": 17,
            "item": "행정정보 공동이용 시스템 운영",
            "score": 0.5469
          },
          "other_dept": null
        },
        {
          "task_id": "T00822",
          "title": "청원심의위원회 운영",
          "kind": "고유업무",
          "label": "직접근거",
          "basis": {
            "law": "오산시 행정기구 및 정원 조례 시행규칙",
            "article": "별표 1(제3조 관련)",
            "item_no": 16,
            "item": "청원심의회 운영",
            "score": 0.7541
          },
          "other_dept": null
        }
      ]
    },
    {
      "seat_id": "S-CIVIL-04",
      "dept_id": "D-CIVIL",
      "team": "민원행정팀",
      "role": "주무관",
      "label": "민원행정팀 주무관 2",
      "tasks": [
        {
          "task_id": "T00823",
          "title": "서무, 회계",
          "kind": "서무·공통",
          "label": "해당없음",
          "basis": null,
          "other_dept": null
        },
        {
          "task_id": "T00824",
          "title": "기록물관리",
          "kind": "서무·공통",
          "label": "해당없음",
          "basis": null,
          "other_dept": null
        },
        {
          "task_id": "T00825",
          "title": "민원서비스 종합평가",
          "kind": "고유업무",
          "label": "후보",
          "basis": {
            "law": "오산시 행정기구 및 정원 조례 시행규칙",
            "article": "별표 1(제3조 관련)",
            "item_no": 1,
            "item": "민원서류(법정민원)의 접수ㆍ심사",
            "score": 0.2346
          },
          "other_dept": null
        },
        {
          "task_id": "T00826",
          "title": "민원제도 개선 및 민원취약계층보호",
          "kind": "고유업무",
          "label": "후보",
          "basis": {
            "law": "오산시 행정기구 및 정원 조례 시행규칙",
            "article": "별표 1(제3조 관련)",
            "item_no": 4,
            "item": "민원행정 및 제도개선",
            "score": 0.3706
          },
          "other_dept": null
        },
        {
          "task_id": "T00827",
          "title": "부서 SNS 홍보",
          "kind": "고유업무",
          "label": "공통사무(총괄부서 근거)",
          "basis": {
            "law": "오산시 행정기구 및 정원 조례 시행규칙",
            "article": "별표 1(제3조 관련)",
            "item_no": 20,
            "item": "SNS 홍보 계획 수립",
            "score": 0.7061
          },
          "other_dept": null
        },
        {
          "task_id": "T00828",
          "title": "친절행정 추진",
          "kind": "고유업무",
          "label": "후보",
          "basis": {
            "law": "오산시 행정기구 및 정원 조례 시행규칙",
            "article": "별표 1(제3조 관련)",
            "item_no": 21,
            "item": "친절도 향상에 관한 사항",
            "score": 0.2255
          },
          "other_dept": null
        }
      ]
    },
    {
      "seat_id": "S-CIVIL-05",
      "dept_id": "D-CIVIL",
      "team": "민원행정팀",
      "role": "주무관",
      "label": "민원행정팀 주무관 3",
      "tasks": [
        {
          "task_id": "T00829",
          "title": "주민등록 업무 총괄",
          "kind": "총괄",
          "label": "해당없음",
          "basis": null,
          "other_dept": null
        },
        {
          "task_id": "T00830",
          "title": "주민등록 사실조사 총괄",
          "kind": "총괄",
          "label": "해당없음",
          "basis": null,
          "other_dept": null
        },
        {
          "task_id": "T00831",
          "title": "주민전산자료제공",
          "kind": "고유업무",
          "label": "근거없음",
          "basis": {
            "law": "오산시 행정기구 및 정원 조례 시행규칙",
            "article": "별표 1(제3조 관련)",
            "item_no": 6,
            "item": "주민등록 인구 통계",
            "score": 0.1072
          },
          "other_dept": null
        },
        {
          "task_id": "T00832",
          "title": "민원담당자 보호 (민원서비스종합평가 분야 포함)",
          "kind": "고유업무",
          "label": "후보",
          "basis": {
            "law": "오산시 행정기구 및 정원 조례 시행규칙",
            "article": "별표 1(제3조 관련)",
            "item_no": 1,
            "item": "민원서류(법정민원)의 접수ㆍ심사",
            "score": 0.2098
          },
          "other_dept": null
        },
        {
          "task_id": "T00833",
          "title": "통합민원 발급(등초본, 인감 등)",
          "kind": "고유업무",
          "label": "후보",
          "basis": {
            "law": "오산시 행정기구 및 정원 조례 시행규칙",
            "article": "별표 1(제3조 관련)",
            "item_no": 14,
            "item": "무인민원발급창구 운영",
            "score": 0.2463
          },
          "other_dept": null
        }
      ]
    },
    {
      "seat_id": "S-CIVIL-06",
      "dept_id": "D-CIVIL",
      "team": "민원행정팀",
      "role": "주무관",
      "label": "민원행정팀 주무관 4",
      "tasks": [
        {
          "task_id": "T00834",
          "title": "인감(본인서명사실증명) 업무 총괄",
          "kind": "총괄",
          "label": "해당없음",
          "basis": null,
          "other_dept": null
        },
        {
          "task_id": "T00835",
          "title": "무인민원발급기 관리",
          "kind": "고유업무",
          "label": "직접근거",
          "basis": {
            "law": "오산시 행정기구 및 정원 조례 시행규칙",
            "article": "별표 1(제3조 관련)",
            "item_no": 14,
            "item": "무인민원발급창구 운영",
            "score": 0.6399
          },
          "other_dept": null
        },
        {
          "task_id": "T00836",
          "title": "통합민원 발급(등초본, 인감 등)",
          "kind": "고유업무",
          "label": "후보",
          "basis": {
            "law": "오산시 행정기구 및 정원 조례 시행규칙",
            "article": "별표 1(제3조 관련)",
            "item_no": 14,
            "item": "무인민원발급창구 운영",
            "score": 0.2463
          },
          "other_dept": null
        }
      ]
    },
    {
      "seat_id": "S-CIVIL-07",
      "dept_id": "D-CIVIL",
      "team": "민원행정팀",
      "role": "주무관",
      "label": "민원행정팀 주무관 5",
      "tasks": [
        {
          "task_id": "T00837",
          "title": "Fax 민원(어디서나 민원)",
          "kind": "고유업무",
          "label": "직접근거",
          "basis": {
            "law": "오산시 행정기구 및 정원 조례 시행규칙",
            "article": "별표 1(제3조 관련)",
            "item_no": 11,
            "item": "정부24민원 및 어디서나 민원",
            "score": 0.6458
          },
          "other_dept": null
        },
        {
          "task_id": "T00838",
          "title": "사실증명서 발급(출입국, 외국인,거소)",
          "kind": "고유업무",
          "label": "후보",
          "basis": {
            "law": "오산시 행정기구 및 정원 조례 시행규칙",
            "article": "별표 1(제3조 관련)",
            "item_no": 10,
            "item": "외국인등록 사실증명 발급",
            "score": 0.5143
          },
          "other_dept": null
        },
        {
          "task_id": "T00839",
          "title": "외국인 체류지 변경",
          "kind": "고유업무",
          "label": "직접근거",
          "basis": {
            "law": "오산시 행정기구 및 정원 조례 시행규칙",
            "article": "별표 1(제3조 관련)",
            "item_no": 9,
            "item": "외국인 거주지 변경신고",
            "score": 0.5132
          },
          "other_dept": null
        }
      ]
    },
    {
      "seat_id": "S-CIVIL-08",
      "dept_id": "D-CIVIL",
      "team": "민원행정팀",
      "role": "주무관",
      "label": "민원행정팀 주무관 6",
      "tasks": [
        {
          "task_id": "T00840",
          "title": "통합민원 발급(등초본, 인감 등)",
          "kind": "고유업무",
          "label": "후보",
          "basis": {